{
  "schema_version": "1.0",
  "project_id": "TestProject",
  "calculation_run_id": "run_example_connector_pin_margin_000001",
  "calculation_id": "calc_connector_pin_current_margin_p20_1",
  "calculation_family": "connector_pin_current_margin",
  "target_type": "pin",
  "target_id": "P20.1",
  "status": "blocked",
  "result": {
    "connector_pin_current_margin": null
  },
  "intermediate_values": {
    "branch_current_a": {"value": 0.45, "unit": "A"},
    "connector_pin_current_rating_a": null
  },
  "input_refs": [],
  "source_artifacts": [
    {
      "artifact_type": "topology_role_resolution",
      "path": "exports/TestProject-topology-role-resolution.json",
      "record_id": "P20",
      "notes": "Connector role is known; per-pin current rating is missing."
    }
  ],
  "evidence_refs": ["role_component_P20"],
  "assumptions": [],
  "missing_inputs": [
    {
      "field": "connector_pin_current_rating_a",
      "reason": "Connector pin current rating is missing; margin calculation is blocked.",
      "required_for": ["connector_pin_current_margin"],
      "manifest_item_id": "mdi_connector_pin_rating_missing_p20_1",
      "recommended_resolution": "datasheet_extraction"
    }
  ],
  "blocked_by_manifest_items": ["mdi_connector_pin_rating_missing_p20_1"],
  "warnings": [],
  "errors": [],
  "confidence": 0.6,
  "human_review_needed": true
}
