{
  "schema_version": "1.0",
  "project_id": "TestProject",
  "calculation_run_id": "run_example_voltage_drop_000001",
  "calculation_id": "calc_voltage_drop_br_v3p3_top_trace_000001",
  "calculation_family": "voltage_drop",
  "target_type": "branch",
  "target_id": "br_v3p3_top_trace_group_000001",
  "status": "blocked",
  "result": {
    "voltage_drop": null
  },
  "intermediate_values": {
    "trace_resistance": {"value": 0.0815, "unit": "ohm"},
    "branch_current_a": null
  },
  "input_refs": ["calc_voltage_drop_br_v3p3_top_trace_000001"],
  "source_artifacts": [
    {
      "artifact_type": "calculation_readiness",
      "path": "exports/TestProject-calculation-readiness-inventory.json",
      "record_id": "br_v3p3_top_trace_group_000001",
      "notes": "Readiness reported branch current unknown."
    }
  ],
  "evidence_refs": ["ev_geo_br_v3p3_top_trace_group_000001_length"],
  "assumptions": [],
  "missing_inputs": [
    {
      "field": "branch_current_a",
      "reason": "Branch current is unresolved; voltage drop is blocked.",
      "required_for": ["voltage_drop"],
      "manifest_item_id": "mdi_manifest_branch_current_unknown_v3p3_mdi_branch_current_unknown_branch_br_v3p3_top_trace_group_000001_copper_calculation_voltage_drop_calculation_thermal_calculation",
      "recommended_resolution": "datasheet_extraction"
    }
  ],
  "blocked_by_manifest_items": [
    "mdi_manifest_branch_current_unknown_v3p3_mdi_branch_current_unknown_branch_br_v3p3_top_trace_group_000001_copper_calculation_voltage_drop_calculation_thermal_calculation"
  ],
  "warnings": [],
  "errors": [],
  "confidence": 0.72,
  "human_review_needed": true
}
